{
  "$schema": "https://json-schema.org/draft/2020-12/schema",
  "$id": "https://ui-sensei.local/schemas/archetype.schema.json",
  "title": "Archetype",
  "type": "object",
  "required": [
    "name",
    "summary",
    "goals",
    "source_sites",
    "layout_rules",
    "typography_rules",
    "component_rules",
    "motion_rules",
    "copy_rules",
    "accessibility_rules",
    "performance_rules",
    "preferred_patterns",
    "anti_patterns"
  ],
  "properties": {
    "name": {
      "type": "string"
    },
    "summary": {
      "type": "string"
    },
    "goals": {
      "type": "array",
      "items": {
        "type": "string"
      }
    },
    "source_sites": {
      "type": "array",
      "items": {
        "type": "string"
      }
    },
    "layout_rules": {
      "type": "array",
      "items": {
        "type": "string"
      }
    },
    "typography_rules": {
      "type": "array",
      "items": {
        "type": "string"
      }
    },
    "component_rules": {
      "type": "array",
      "items": {
        "type": "string"
      }
    },
    "motion_rules": {
      "type": "array",
      "items": {
        "type": "string"
      }
    },
    "copy_rules": {
      "type": "array",
      "items": {
        "type": "string"
      }
    },
    "accessibility_rules": {
      "type": "array",
      "items": {
        "type": "string"
      }
    },
    "performance_rules": {
      "type": "array",
      "items": {
        "type": "string"
      }
    },
    "preferred_patterns": {
      "type": "array",
      "items": {
        "type": "string"
      }
    },
    "anti_patterns": {
      "type": "array",
      "items": {
        "type": "string"
      }
    },
    "notes": {
      "type": "array",
      "items": {
        "type": "string"
      }
    }
  },
  "additionalProperties": false
}
